cat1_name	cat2_name	goods_name	skc_id	sale_price	origin_price	href	style	material	length	stereotype	img_srcT恤/衬衫	短袖衬衫	棉质字母宽松短袖衬衫	3GI2014110910	￥419	￥699	/p/3GI2014110910.shtml	海魂条纹元素，以冲突感配色营造青春活力之感；oversize廓形剪裁，巧妙呼应款式风格，刻画率性潮人型格；背后大面积slogan，点睛不羁街头气息，范儿加分；主面料为纯棉质地，贴身穿着舒适亲肤透气；潮流又百搭，单穿或作为外套穿着皆可；简单搭配百慕大短裤、低帮鞋，演绎出时髦潮帅大男孩形象	主料:棉100%(绣花线除外)撞料:棉96.3% 氨纶3.7%	中长	宽松	http://img1.ochirly.com.cn/wcsstore/TrendyCatalogAssetStore/images/trendy/trendiano/2018/b/3GI2014110910/3GI2014110910_m_1.jpgT恤/衬衫	短袖衬衫	宽松中长拼接短袖衬衫	3GI2014230000	￥419	￥699	/p/3GI2014230000.shtml	前幅大片印花薄纱拼接，告别传统剪裁，赋予休闲衬衣更多前卫潮流解读，倍添摩登新意；中长款宽松廓形，随性休闲巧妙碰撞个性印花，营造出别样时髦味道；含棉面料拼接轻薄材质，层次丰富，穿着舒适有范；时尚单品，与素色短裤尤为合拍，加入板鞋，上衣成为视觉聚焦点，打造年轻且cool印象，存在感升级	面料:棉69.9% 聚酯纤维30.1%撞料:聚酯纤维100%	中长	宽松	http://img1.ochirly.com.cn/wcsstore/TrendyCatalogAssetStore/images/trendy/trendiano/2018/b/3GI2014230000/3GI2014230000_m_1.jpgT恤/衬衫	短袖衬衫	短袖衬衫宽松字母印花	3GI2014430090	￥639	￥799	/p/3GI2014430090.shtml	把街头涂鸦艺术搬上衬衫设计中，高饱和度色彩与随性字母混搭出别样火花，让人过目不忘，演绎出时髦摩登的都市现代感；oversize廓形剪裁，巧妙呼应款式风格，提升休闲轻松之感；特选缎纹布打造，手感顺滑，且拥有柔和光泽感，穿着舒适有型；与简约风下装相当速配，加入板鞋，塑造休闲帅气Style；亦可与宽松短裤、凉鞋混搭，清爽又chic的夏日潮人造型信手拈来	面料:聚酯纤维100%	适中	宽松	http://img1.ochirly.com.cn/wcsstore/TrendyCatalogAssetStore/images/trendy/trendiano/2018/b/3GI2014430090/3GI2014430090_m_1.jpgT恤/衬衫	短袖衬衫	宽松中长拼接短袖衬衫	3GI2014230090	￥419	￥699	/p/3GI2014230090.shtml	前幅大片印花薄纱拼接，告别传统剪裁，赋予休闲衬衣更多前卫潮流解读，倍添摩登新意；中长款宽松廓形，随性休闲巧妙碰撞个性印花，营造出别样时髦味道；含棉面料拼接轻薄材质，层次丰富，穿着舒适有范；时尚单品，与素色短裤尤为合拍，加入板鞋，上衣成为视觉聚焦点，打造年轻且cool印象，存在感升级	面料:棉69.9% 聚酯纤维30.1%撞料:聚酯纤维100%	中长	宽松	http://img1.ochirly.com.cn/wcsstore/TrendyCatalogAssetStore/images/trendy/trendiano/2018/b/3GI2014230090/3GI2014230090_m_1.jpgT恤/衬衫	短袖衬衫	纯棉字母连帽短袖衬衫	3GC1011150000	￥419	￥699	/p/3GC1011150000.shtml	以改良式连帽卫衣廓形，表达衬衫，一改传统干练印象，尤显休闲活力气息；后幅Slogan印花，成为本款亮点所在，轻松秀出专属年轻时尚姿态；特选纯棉面料打造，柔韧细洁，穿着舒适透气；与各式长裤、九分裤、短裤等皆可混搭，值得入手；碰撞吊裆哈伦裤、板鞋，酷帅有型；亦可与百慕大短裤、中途袜、休闲鞋，营造出运动活力Style，格外减龄	面料:棉100%	适中	合体	http://img1.ochirly.com.cn/wcsstore/TrendyCatalogAssetStore/images/trendy/trendiano/2018/a/3GC1011150000/3GC1011150000_m_1.jpgT恤/衬衫	短袖衬衫	刺绣拼接宽松套头衬衫	3GC1013450090	￥489	￥699	/p/3GC1013450090.shtml	Logo装饰在时尚界一贯大行其道，秉承其耐看长青的性质而深受大众追捧；本款运用精致刺绣工艺配以鲜明撞色，勾画细致Logo轻轻装点胸前与领后，吸睛而不过分花俏；后幅异材质布块拼接，配以相近色调，赋予衣身别样视觉层次效果；宽松版型设计，线条处理恰到好处，呼应休闲基调；精选面料打造，含少量亚麻成分，穿着舒适自在；百搭时髦上装，下装配入休闲裤或牛仔裤，加入板鞋，轻松演绎简约帅气造型	面料:聚酯纤维51% 亚麻49%撞料1:锦纶100%撞料2:聚酯纤维100%	适中	宽松	http://img1.ochirly.com.cn/wcsstore/TrendyCatalogAssetStore/images/trendy/trendiano/2018/a/3GC1013450090/3GC1013450090_m_1.jpgT恤/衬衫	短袖衬衫	刺绣拼接宽松套头衬衫	3GC1013450530	￥489	￥699	/p/3GC1013450530.shtml	Logo装饰在时尚界一贯大行其道，秉承其耐看长青的性质而深受大众追捧；本款运用精致刺绣工艺配以鲜明撞色，勾画细致Logo轻轻装点胸前与领后，吸睛而不过分花俏；后幅异材质布块拼接，配以相近色调，赋予衣身别样视觉层次效果；宽松版型设计，线条处理恰到好处，呼应休闲基调；精选面料打造，含少量亚麻成分，穿着舒适自在；百搭时髦上装，下装配入休闲裤或牛仔裤，加入板鞋，轻松演绎简约帅气造型	面料:聚酯纤维51% 亚麻49%撞料1:锦纶100%撞料2:聚酯纤维100%	适中	宽松	http://img1.ochirly.com.cn/wcsstore/TrendyCatalogAssetStore/images/trendy/trendiano/2018/a/3GC1013450530/3GC1013450530_m_1.jpgT恤/衬衫	短袖衬衫	拼接纯色刺绣短袖衬衫	3GE1013460000	￥419	￥699	/p/3GE1013460000.shtml	Logo装饰在时尚界一贯大行其道，秉承其耐看长青的性质而深受大众追捧；运用精致刺绣工艺勾画同色英文小Logo，轻轻点缀衣身，低调而雅致；后幅异材质布块拼接，配以相同颜色降低喧嚣夺目感，赋予衣身别样视觉层次效果；精选面料打造，含少量亚麻成分，带着舒适透气的穿着体验；百搭时髦上装，下装配入纯色休闲裤，加入板鞋，轻松打造简约帅气造型	面料:莱赛尔85.7% 亚麻14.3%撞料:聚酯纤维100%罗纹:粘纤77.4% 锦纶20.8% 氨纶1.8%	适中	合体	http://img1.ochirly.com.cn/wcsstore/TrendyCatalogAssetStore/images/trendy/trendiano/2018/a/3GE1013460000/3GE1013460000_m_1.jpgT恤/衬衫	短袖衬衫	拼接纯色刺绣短袖衬衫	3GE1013460090	￥419	￥699	/p/3GE1013460090.shtml	Logo装饰在时尚界一贯大行其道，秉承其耐看长青的性质而深受大众追捧；运用精致刺绣工艺勾画同色英文小Logo，轻轻点缀衣身，低调而雅致；后幅异材质布块拼接，配以相同颜色降低喧嚣夺目感，赋予衣身别样视觉层次效果；精选面料打造，含少量亚麻成分，带着舒适透气的穿着体验；百搭时髦上装，下装配入纯色休闲裤，加入板鞋，轻松打造简约帅气造型	面料:莱赛尔87.2% 亚麻12.8%撞料:聚酯纤维100%罗纹:粘纤77.4% 锦纶20.8% 氨纶1.8%	适中	合体	http://img1.ochirly.com.cn/wcsstore/TrendyCatalogAssetStore/images/trendy/trendiano/2018/a/3GE1013460090/3GE1013460090_m_1.jpg